<?xml version="1.0" encoding="UTF-8"?>
<!DOCTYPE aboutOrders SYSTEM "aboutOrders.dtd">
<aboutOrders dateFrom="17-10-2020" dateTo="24-10-2020">
  <allOrders>
    <order>
      <orderCode>66</orderCode>
      <lastName>Takos</lastName>
      <firstName>Takis</firstName>
      <totalValue>4.05</totalValue>
    </order>
    <order>
      <orderCode>67</orderCode>
      <lastName>Takos</lastName>
      <firstName>Takis</firstName>
      <totalValue>2.1</totalValue>
    </order>
  </allOrders>
  <popProducts>
    <product>
      <prodCode>22</prodCode>
      <prodName>Σκυλοπαιχνίδι Σκαντζόχοιρος</prodName>
      <totalSoldQuantity>3</totalSoldQuantity>
    </product>
    <product>
      <prodCode>24</prodCode>
      <prodName>Skylo-news</prodName>
      <totalSoldQuantity>1</totalSoldQuantity>
    </product>
  </popProducts>
</aboutOrders>
