<?xml version="1.0" encoding="UTF-8"?>
<!DOCTYPE aboutOrders SYSTEM "aboutOrders.dtd">
<aboutOrders dateFrom="18-10-2020" dateTo="26-10-2020">
  <allOrders>
    <order>
      <orderCode>73</orderCode>
      <lastName>Γατου</lastName>
      <firstName>Στεφανια</firstName>
      <totalValue>145.9</totalValue>
    </order>
    <order>
      <orderCode>76</orderCode>
      <lastName>Σουγιας</lastName>
      <firstName>Μπαμπης</firstName>
      <totalValue>122.8</totalValue>
    </order>
    <order>
      <orderCode>78</orderCode>
      <lastName>Σουγιας</lastName>
      <firstName>Μπαμπης</firstName>
      <totalValue>81.05</totalValue>
    </order>
    <order>
      <orderCode>70</orderCode>
      <lastName>Κοκωνης</lastName>
      <firstName>Στελιος</firstName>
      <totalValue>59.2</totalValue>
    </order>
    <order>
      <orderCode>72</orderCode>
      <lastName>Κοκωνης</lastName>
      <firstName>Στελιος</firstName>
      <totalValue>53.5</totalValue>
    </order>
    <order>
      <orderCode>79</orderCode>
      <lastName>Πεκος</lastName>
      <firstName>Γιώργος</firstName>
      <totalValue>25.45</totalValue>
    </order>
    <order>
      <orderCode>69</orderCode>
      <lastName>Τσαλτιδης</lastName>
      <firstName>Τακης</firstName>
      <totalValue>25.45</totalValue>
    </order>
    <order>
      <orderCode>68</orderCode>
      <lastName>Πεκος</lastName>
      <firstName>Γιώργος</firstName>
      <totalValue>25.45</totalValue>
    </order>
    <order>
      <orderCode>74</orderCode>
      <lastName>Γατου</lastName>
      <firstName>Στεφανια</firstName>
      <totalValue>25.45</totalValue>
    </order>
    <order>
      <orderCode>71</orderCode>
      <lastName>Κοκωνης</lastName>
      <firstName>Στελιος</firstName>
      <totalValue>16.4</totalValue>
    </order>
    <order>
      <orderCode>75</orderCode>
      <lastName>Γατου</lastName>
      <firstName>Στεφανια</firstName>
      <totalValue>10.85</totalValue>
    </order>
    <order>
      <orderCode>66</orderCode>
      <lastName>Τσαλτιδης</lastName>
      <firstName>Τακης</firstName>
      <totalValue>4.05</totalValue>
    </order>
    <order>
      <orderCode>67</orderCode>
      <lastName>Τσαλτιδης</lastName>
      <firstName>Τακης</firstName>
      <totalValue>2.1</totalValue>
    </order>
    <order>
      <orderCode>77</orderCode>
      <lastName>Σουγιας</lastName>
      <firstName>Μπαμπης</firstName>
      <totalValue>2.1</totalValue>
    </order>
  </allOrders>
  <popProducts>
    <product>
      <prodCode>23</prodCode>
      <prodName>Mocdog</prodName>
      <totalSoldQuantity>15</totalSoldQuantity>
    </product>
    <product>
      <prodCode>22</prodCode>
      <prodName>Σκυλοπαιχνίδι Σκαντζόχοιρος</prodName>
      <totalSoldQuantity>11</totalSoldQuantity>
    </product>
    <product>
      <prodCode>24</prodCode>
      <prodName>Skylo-news</prodName>
      <totalSoldQuantity>7</totalSoldQuantity>
    </product>
    <product>
      <prodCode>10</prodCode>
      <prodName>Σκυλο-Μπαλάκι</prodName>
      <totalSoldQuantity>7</totalSoldQuantity>
    </product>
    <product>
      <prodCode>13</prodCode>
      <prodName>Redneck</prodName>
      <totalSoldQuantity>6</totalSoldQuantity>
    </product>
  </popProducts>
</aboutOrders>
